{
  "schema_version": 1,
  "contract": "noc-alarm-mapped.v1",
  "vendor": "aviat",
  "source_system": "cplatform-http-simulator",
  "source_file": "CURRENT_ALARM_REPORT.csv",
  "source_row": 1,
  "event_id": "sha256:8b1a9953c4611296a827abf8c47804d7f5f31e5d2f5e3c6d9f7d1d4f7a2f4d0a",
  "alarm_key": "aviat:UEMWBSNA01:1603",
  "external_alarm_id": "1603",
  "event_description": "Ethernet port link down",
  "object": "L1LA1",
  "site_id": "UEMWBSNA01",
  "node_id": "UEMWBSNA01",
  "severity": "major",
  "state": "active",
  "event_type": "raise",
  "canonical_category": "UNKNOWN",
  "probable_cause_raw": "Ethernet port link down",
  "specific_problem": "",
  "source_event_time": "2026-08-14T10:00:00Z",
  "effective_event_time": "2026-08-14T10:00:00Z",
  "device_raised_at": null,
  "device_cleared_at": null,
  "nms_cleared_at": null,
  "ingested_at": "2026-08-14T10:00:01Z",
  "trace_id": "http:CURRENT_ALARM_REPORT.csv:1",
  "stream_id": "aviat-stream",
  "replay_cycle_id": "sim-20260814",
  "replay_sequence": 1,
  "Circle": "UE",
  "Cleared": null,
  "SpecificProblem": "",
  "ProbableCause": "Ethernet port link down",
  "AlarmID": "1603",
  "Site": "UEMWBSNA01",
  "Severity": "Major",
  "State": "Active",
  "AlarmName": "Ethernet port link down",
  "Raised": "2026-08-14T10:00:00Z"
}
